{
  "id": "ai_transformation_promo",
  "title": "AI Transformation with DEQX",
  "format": "how_it_works",
  "style": "print",
  "channel": "instagram",
  "brand": "brand/brand.json",
  "facts": "facts/ai_transformation.md",
  "cta": {
    "keyword": "AI",
    "line": "Explore AI Transformation with DEQX"
  },
  "beats": [
    {
      "id": "hook",
      "start": 0.0,
      "end": 3.72,
      "text": "AI transformation should start with a business problem.",
      "emphasis": "AI",
      "chapter": "01 - the hook",
      "theme": "light",
      "scene": "hook_title",
      "props": {
        "title": "AI WITH PURPOSE",
        "tag": "DEQX | AI TRANSFORMATION"
      }
    },
    {
      "id": "approach",
      "start": 3.72,
      "end": 8.57,
      "text": "Not just more technology. A thoughtful approach to the challenge you need to solve.",
      "emphasis": "challenge",
      "chapter": "02 - the approach",
      "theme": "light",
      "scene": "statement",
      "props": {
        "title": "START WITH WHY",
        "sub": "Understand the challenge first"
      }
    },
    {
      "id": "capabilities",
      "start": 8.57,
      "end": 12.79,
      "text": "Explore LLM fine-tuning and private LLM deployments.",
      "emphasis": "Explore",
      "chapter": "03 - the possibilities",
      "progress": "AI SERVICES",
      "theme": "light",
      "claims": [
        "F1"
      ],
      "scene": "checklist",
      "props": {
        "title": "Explore AI capabilities",
        "items": [
          "LLM Fine-Tuning",
          "Private LLM Deployments"
        ]
      }
    },
    {
      "id": "edge_ai",
      "start": 12.79,
      "end": 16.27,
      "text": "Discover edge AI and computer vision solutions.",
      "emphasis": "Discover",
      "chapter": "03 - the possibilities",
      "progress": "AI SERVICES",
      "theme": "light",
      "claims": [
        "F1"
      ],
      "scene": "checklist",
      "props": {
        "title": "Explore AI capabilities",
        "items": [
          "Edge AI",
          "Computer Vision"
        ]
      }
    },
    {
      "id": "automation",
      "start": 16.27,
      "end": 21.62,
      "text": "AI automation and intelligent agents are also part of the service landscape.",
      "emphasis": "automation",
      "chapter": "04 - intelligent automation",
      "theme": "dark",
      "claims": [
        "F1"
      ],
      "scene": "statement",
      "props": {
        "title": "SMART AUTOMATION",
        "sub": "AI Automation & Intelligent Agents"
      }
    },
    {
      "id": "mindset",
      "start": 21.62,
      "end": 25.25,
      "text": "The goal is to explore an approach that fits your business needs.",
      "emphasis": "approach",
      "chapter": "05 - the right fit",
      "theme": "dark",
      "scene": "myth_card",
      "props": {
        "number": 1,
        "myth": "AI for the sake of AI",
        "truth": "Start with a real business need"
      }
    },
    {
      "id": "cta",
      "start": 25.25,
      "end": 30.42,
      "text": "Ready to explore AI transformation? Connect with DEQX.",
      "emphasis": "DEQX",
      "chapter": "06 - your next step",
      "theme": "accent",
      "scene": "cta",
      "props": {
        "sub": "Explore AI Transformation with DEQX"
      }
    }
  ],
  "voice": {
    "file": "work\\ai_transformation_promo\\voice\\vo.wav",
    "provider": "kokoro:am_michael",
    "words": "work\\ai_transformation_promo\\voice\\words.json"
  }
}
